{
 "authority": {
  "can_decide": false,
  "exploratory": true,
  "note": "Discovery coverage evidence only; screening tiers order work and never exclude or decide. M5 stays unaccepted (Cory). Current Birthday screening/discovery only; does not reopen frozen B-F or decide a swap."
 },
 "blind_spots": [
  {
   "cards": [
    {
     "card": "Auspicious Aquarium",
     "legal_from": "2026-10-19"
    },
    {
     "card": "Balefang the Unslayable",
     "legal_from": "2026-10-19"
    },
    {
     "card": "Boss Uramon, Shadow's Reach",
     "legal_from": "2026-10-19"
    },
    {
     "card": "Chira, All In",
     "legal_from": "2026-10-19"
    },
    {
     "card": "Dragon's Smile",
     "legal_from": "2026-10-19"
    },
    {
     "card": "Dyfed, the Guiding Hand",
     "legal_from": "2026-10-19"
    },
    {
     "card": "Flitwing, Lyev Detective",
     "legal_from": "2026-10-19"
    },
    {
     "card": "Grandmother Goby",
     "legal_from": "2026-10-19"
    },
    {
     "card": "Gustha Ebbasdotter",
     "legal_from": "2026-10-19"
    },
    {
     "card": "Istvan, Butcher of Eln",
     "legal_from": "2026-10-19"
    },
    {
     "card": "Itazura, Lingering Wick",
     "legal_from": "2026-10-19"
    },
    {
     "card": "Jabs, Mistress of Mockery",
     "legal_from": "2026-10-19"
    },
    {
     "card": "Kuroki, Thief of Talents",
     "legal_from": "2026-10-19"
    },
    {
     "card": "Matoc, Lavamancer",
     "legal_from": "2026-10-19"
    },
    {
     "card": "Miss Highwater",
     "legal_from": "2026-10-19"
    },
    {
     "card": "Olinda the Oblivious",
     "legal_from": "2026-10-19"
    },
    {
     "card": "Sahir, Visitor in Darkness",
     "legal_from": "2026-10-19"
    },
    {
     "card": "Sash and Waistcoat, Unmen",
     "legal_from": "2026-10-19"
    },
    {
     "card": "Sifa Grent",
     "legal_from": "2026-10-19"
    },
    {
     "card": "The Everforger",
     "legal_from": "2026-10-19"
    },
    {
     "card": "The Madcap Jester",
     "legal_from": "2026-10-19"
    },
    {
     "card": "The Unluckiest Planeswalker",
     "legal_from": "2026-10-19"
    },
    {
     "card": "The Weaver King",
     "legal_from": "2026-10-19"
    },
    {
     "card": "Thomil, the Destroyer",
     "legal_from": "2026-10-19"
    },
    {
     "card": "Tolabow, Loch Rascal",
     "legal_from": "2026-10-19"
    },
    {
     "card": "Tresserhorn's Lord, Returned",
     "legal_from": "2026-10-19"
    },
    {
     "card": "Valko Indorian",
     "legal_from": "2026-10-19"
    },
    {
     "card": "A Good Day to Die",
     "legal_from": "2026-11-13"
    },
    {
     "card": "Assault Drone",
     "legal_from": "2026-11-13"
    },
    {
     "card": "Automated Warfare System",
     "legal_from": "2026-11-13"
    },
    {
     "card": "Badgey, Malicious Glitch",
     "legal_from": "2026-11-13"
    },
    {
     "card": "Bat'leth",
     "legal_from": "2026-11-13"
    },
    {
     "card": "Battle-Scarred Survivalist",
     "legal_from": "2026-11-13"
    },
    {
     "card": "Beckett Mariner, Impetuous Ensign",
     "legal_from": "2026-11-13"
    },
    {
     "card": "Bio-Asset Allocator",
     "legal_from": "2026-11-13"
    },
    {
     "card": "Cantankerous Captain",
     "legal_from": "2026-11-13"
    },
    {
     "card": "Captain James T. Kirk",
     "legal_from": "2026-11-13"
    },
    {
     "card": "Captain's Tutelage",
     "legal_from": "2026-11-13"
    },
    {
     "card": "Ceti Eel",
     "legal_from": "2026-11-13"
    },
    {
     "card": "Cha'DIch Investigator",
     "legal_from": "2026-11-13"
    },
    {
     "card": "Cloistered Telepath",
     "legal_from": "2026-11-13"
    },
    {
     "card": "Collective Drone",
     "legal_from": "2026-11-13"
    },
    {
     "card": "Consider the Prime Directive",
     "legal_from": "2026-11-13"
    },
    {
     "card": "Cryogenic Stasis",
     "legal_from": "2026-11-13"
    },
    {
     "card": "Crystalline Entity",
     "legal_from": "2026-11-13"
    },
    {
     "card": "Cybernetic Specialist",
     "legal_from": "2026-11-13"
    },
    {
     "card": "Defense Force Aggressor",
     "legal_from": "2026-11-13"
    },
    {
     "card": "Direct Hit",
     "legal_from": "2026-11-13"
    },
    {
     "card": "Disruptor Pistol",
     "legal_from": "2026-11-13"
    },
    {
     "card": "Dominion Saboteur",
     "legal_from": "2026-11-13"
    },
    {
     "card": "Eject the Warp Core",
     "legal_from": "2026-11-13"
    },
    {
     "card": "Exocomp",
     "legal_from": "2026-11-13"
    },
    {
     "card": "Federation Probe",
     "legal_from": "2026-11-13"
    },
    {
     "card": "General Chang, Cold Warrior",
     "legal_from": "2026-11-13"
    },
    {
     "card": "Gin'tak Charge",
     "legal_from": "2026-11-13"
    },
    {
     "card": "Guidance Failure",
     "legal_from": "2026-11-13"
    },
    {
     "card": "He's Dead, Jim",
     "legal_from": "2026-11-13"
    },
    {
     "card": "Highly Illogical",
     "legal_from": "2026-11-13"
    },
    {
     "card": "Hive Mind Coprocessor",
     "legal_from": "2026-11-13"
    },
    {
     "card": "Horta",
     "legal_from": "2026-11-13"
    },
    {
     "card": "Hoshi Sato, Exolinguist",
     "legal_from": "2026-11-13"
    },
    {
     "card": "Humpback Whales",
     "legal_from": "2026-11-13"
    },
    {
     "card": "In the Pale Moonlight",
     "legal_from": "2026-11-13"
    },
    {
     "card": "Khaaaaaaaaaaaannn!",
     "legal_from": "2026-11-13"
    },
    {
     "card": "Klingon Strike Force",
     "legal_from": "2026-11-13"
    },
    {
     "card": "Kolinahr Priest",
     "legal_from": "2026-11-13"
    },
    {
     "card": "Kruge, Genesis Seeker",
     "legal_from": "2026-11-13"
    },
    {
     "card": "La Forge, Perceptive Engineer",
     "legal_from": "2026-11-13"
    },
    {
     "card": "La'An Noonien-Singh, Security",
     "legal_from": "2026-11-13"
    },
    {
     "card": "Marooned",
     "legal_from": "2026-11-13"
    },
    {
     "card": "Mek'leth Berserker",
     "legal_from": "2026-11-13"
    },
    {
     "card": "Munitions Enthusiast",
     "legal_from": "2026-11-13"
    },
    {
     "card": "Open Communications",
     "legal_from": "2026-11-13"
    },
    {
     "card": "Organic Avulsion Unit",
     "legal_from": "2026-11-13"
    },
    {
     "card": "Pelia, Immortal Innovator",
     "legal_from": "2026-11-13"
    },
    {
     "card": "Perils of the Past",
     "legal_from": "2026-11-13"
    },
    {
     "card": "Planetary Patrol",
     "legal_from": "2026-11-13"
    },
    {
     "card": "Plasma Cascade",
     "legal_from": "2026-11-13"
    },
    {
     "card": "Relentless Drednok",
     "legal_from": "2026-11-13"
    },
    {
     "card": "Resistance Is Futile",
     "legal_from": "2026-11-13"
    },
    {
     "card": "Rogue Artificial Intelligence",
     "legal_from": "2026-11-13"
    },
    {
     "card": "Salt Vampire",
     "legal_from": "2026-11-13"
    },
    {
     "card": "Seven of Nine",
     "legal_from": "2026-11-13"
    },
    {
     "card": "Silicate Surveyor",
     "legal_from": "2026-11-13"
    },
    {
     "card": "T'Pol, Vulcan Representative",
     "legal_from": "2026-11-13"
    },
    {
     "card": "Trelane, Squire of Gothos",
     "legal_from": "2026-11-13"
    },
    {
     "card": "U.S.S. Enterprise-D, Galaxy-Class",
     "legal_from": "2026-11-13"
    },
    {
     "card": "V'Ger, the Intruder",
     "legal_from": "2026-11-13"
    },
    {
     "card": "Warship Flight Crew",
     "legal_from": "2026-11-13"
    },
    {
     "card": "Hela's Arcanum",
     "legal_from": "2027-04-09"
    },
    {
     "card": "Hela, Mistress of Darkness // Dark Tutor",
     "legal_from": "2027-04-09"
    },
    {
     "card": "Magik, Illyana Rasputin // Darkchild, Demon Uncaged",
     "legal_from": "2027-04-09"
    },
    {
     "card": "Rise from the Nether",
     "legal_from": "2027-04-09"
    },
    {
     "card": "Spirit Sorcerer Token",
     "legal_from": "2027-04-09"
    },
    {
     "card": "The Darkhold",
     "legal_from": "2027-04-09"
    }
   ],
   "kind": "unreleased_not_yet_legal",
   "note": "Excluded from candidates until legal; picked up at the Birthday snapshot."
  },
  {
   "kind": "spellbook_snapshot",
   "note": "Commander Spellbook near-misses come from the cached almostIncluded snapshot (one missing piece only)."
  },
  {
   "kind": "edhrec_pages",
   "note": "EDHREC rows exist only for the commander page(s) in the evidence layer; partner/background pages may be thin."
  },
  {
   "kind": "tournament",
   "note": "Tournament evidence exists only for cEDH-ceiling decks and is sparse; an empty tournament pass is recorded, not an error."
  },
  {
   "kind": "screening_model",
   "note": "Sweep-only cards are scored by the M5 screening function; a card whose value it does not model can sit low in tier C (still in the universe)."
  }
 ],
 "cycle": "ChatGPT cycle 74 Birthday current A",
 "deck_id": "Obeka__Brute_Chronologist",
 "escalated_untested_queue": [],
 "evidence_class": "derived_metric",
 "generated_by": "scripts/grixis_saturation.py v3 via grixis_birthday_m5.py v1",
 "hard_exclusion_kinds": [
  "not_commander_legal",
  "outside_colour_identity",
  "already_in_list",
  "basic_land",
  "unresolved_name"
 ],
 "hard_exclusions": {
  "already_in_list": 97,
  "not_commander_legal": 1742,
  "outside_colour_identity": 14587
 },
 "kind": "saturation_certificate",
 "last_material_pass": 13,
 "list_hash": "lh1:958f40565c66c18bf18f1451bac9e933497046c04dc54e58811bfac18d794e66",
 "passes": [
  {
   "eligible_signalled": 163,
   "first_signal": 163,
   "first_signal_at_or_above_score": 100,
   "index": 1,
   "inputs": [
    "data/grixis/birthday_m5/evidence/obeka-brute-chronologist.json"
   ],
   "kind": "signal",
   "material": true,
   "new_escalated": 54,
   "nominated": 172,
   "pass": "edhrec",
   "unresolved_names": 9
  },
  {
   "eligible_signalled": 126,
   "first_signal": 116,